[
  {
    "id": "2090655236155384288",
    "platform": "x",
    "account": {
      "username": "elonmusk"
    },
    "published_at": "2026-08-21T04:20:25Z",
    "content": "Starship is so sci-fi",
    "url": "https://x.com/elonmusk/status/2090655236155384288",
    "media": [
      {
        "type": "image",
        "source_url": "https://pbs.twimg.com/media/HQN_2q3acAARIH_.jpg?name=orig"
      }
    ],
    "metadata": {
      "collected_at": "2026-08-21T04:30:00Z",
      "collector": "hermes"
    }
  },
  {
    "id": "2090628549745291611",
    "platform": "x",
    "account": {
      "username": "elonmusk"
    },
    "published_at": "2026-08-21T02:34:22Z",
    "content": "True",
    "url": "https://x.com/elonmusk/status/2090628549745291611",
    "metadata": {
      "collected_at": "2026-08-21T04:30:00Z",
      "collector": "hermes"
    }
  }
]
